{
  "priority_level": "CRITICAL",
  "strategic_objective": "Validate the market demand for AI-generated legal contract templates and develop a zero-cost solution within the next two weeks.",
  "kpi_target": "Achieve a 20% conversion rate of users signing up for the waitlist and gather feedback from at least 50 small business owners and freelancers.",
  "routing": {
    "CPO": "Lead the validation sprint and oversee the development of the AI-generated legal contract template solution.",
    "CMO": "Develop a marketing strategy to promote the waitlist and gather feedback from users.",
    "CTO": "Explore the technical feasibility of integrating open-source AI models and free hosting solutions.",
    "COO": "Ensure the solution aligns with the company's zero-cost infrastructure mandate and monitor progress."
  }
}